{
  "created_at_utc": "2026-08-25T08:08:21.539039+00:00",
  "evidence_kind": "REPRODUCIBILITY_REVALIDATION_NOT_ORIGINAL_ACCEPTANCE_ARCHIVE",
  "receipt_id": "x4_r6_dhcp_dns_service_security_evidence_receipt_v1",
  "runs": [
    {
      "artifacts": [
        {
          "path": "diagnosis/diagnosis_result_v2.json",
          "sha256": "81139f1aef32451bcc4881733854d3567ecbf5517b00f651ac7f65db71660fff",
          "size_bytes": 833
        },
        {
          "path": "manifest.json",
          "sha256": "7db31bcfec540217321c8ca7e301e5b9e51b6d6ebd14019f173655aee92dd0a7",
          "size_bytes": 512
        },
        {
          "path": "mutation/injection_record.json",
          "sha256": "5a3642a97a686bc4f400ff8e5a63086858b479bacf73f12b0328cf4483d1f56a",
          "size_bytes": 2324
        },
        {
          "path": "mutation/preconditions.json",
          "sha256": "dd7e51eaf91529536c2464ce7999381128d6d5fea37faf08acc5d6af14a7ea89",
          "size_bytes": 1693
        },
        {
          "path": "mutation/recovery_intent.json",
          "sha256": "e8bc465cf03f07ad958cbd36145bc43a164cbfd96930437def614a757285acb4",
          "size_bytes": 398
        },
        {
          "path": "mutation/restoration_record.json",
          "sha256": "069f66378cd741578903ccaa2cbbab41fd4edcce0c2275369fe6b4c63baf1de7",
          "size_bytes": 2438
        },
        {
          "path": "parsed/evidence_v4.json",
          "sha256": "a8eb5380da88830ebbf29663815484c42240b6a8197900c3edfeb4233c7b65b0",
          "size_bytes": 5909
        },
        {
          "path": "parsed/feature_vector_v2.json",
          "sha256": "4d1ab4b665b515f5541acae6098610d6bfd3b444d8c530e93ca584b7243bea35",
          "size_bytes": 1303
        },
        {
          "path": "raw/v4/service_state_collector/dhcp_lease_exchange.json",
          "sha256": "e53e6754697d129c040833daa301836e4790fad3798d75f98ec15d9822eb331a",
          "size_bytes": 1221
        },
        {
          "path": "raw/v4/service_state_collector/dns_network_probe.json",
          "sha256": "7448f2c8cc224def3ededc763b2d8c820aa7fdde24a9ed364182e6d2d803abf1",
          "size_bytes": 584
        },
        {
          "path": "raw/v4/service_state_collector/dns_query.json",
          "sha256": "239485db8f810ca61d239bb72957b45768a217e13f89ae0ba1228021c2de83f7",
          "size_bytes": 345
        },
        {
          "path": "raw/v4/service_state_collector/service_policy.json",
          "sha256": "b1a91082f716b2510af77128a5f1e73e44c40ea9ce2d71b14ca31e570ddb707f",
          "size_bytes": 332
        },
        {
          "path": "raw/v4/service_state_collector/service_port.json",
          "sha256": "2eada5efe85edc2ad9218b76762c1c84a1039d6ee74d01b324f39177f8fe3b64",
          "size_bytes": 389
        },
        {
          "path": "raw/v4/service_state_collector/service_process.json",
          "sha256": "3f80fb53fb753fd85e583e49883765db1eaf9b335aa98e49fef13586475f38ab",
          "size_bytes": 319
        },
        {
          "path": "validation/baseline_after.json",
          "sha256": "904bffe0dc67d5fbf43f8ca1a8331fce72fa984b7eabb4d2d8e783e673c10ba5",
          "size_bytes": 1055
        },
        {
          "path": "validation/baseline_before.json",
          "sha256": "687595b8b1327b3c68586c595121b67d66177cb8feab8117c3ce8cb5d54c869b",
          "size_bytes": 1055
        }
      ],
      "fault_type": "dhcp_server_unavailable",
      "relative_run_path": "data/raw/x4_revalidation.MHRrrP/x4_r1/x4-r1-real-dhcp-server-unavailable",
      "release_id": "X4_R1_DHCP_SERVER_UNAVAILABLE",
      "rule_id": "R_X4_SERVICE_SECURITY_001",
      "run_tree_sha256": "48a297b89a313cc4471e5f34529b3bdabfba621bca375786111c32338f28e296",
      "topology_context_id": "x4_top_01_dhcp_dns_service_security_dhcp_flow_context_v1"
    },
    {
      "artifacts": [
        {
          "path": "diagnosis/diagnosis_result_v2.json",
          "sha256": "dd8dc5e808a4e5070b2f573873736983253c4d5d37a155abd9b414625616ad4a",
          "size_bytes": 819
        },
        {
          "path": "manifest.json",
          "sha256": "626abeb445fb739dc4cdfc44a64411259f4e1e399e93dc65add3c7281c89ae8b",
          "size_bytes": 521
        },
        {
          "path": "mutation/injection_record.json",
          "sha256": "1cd66f52c437875b1a9a84f2a278b4ae972339f0ee24fc88020fb7692761ba3d",
          "size_bytes": 4338
        },
        {
          "path": "mutation/preconditions.json",
          "sha256": "491fe0aa3d1d945b543a1868d246f5a5c89b58ac23fb1015e47529bdd1e3e2f5",
          "size_bytes": 3055
        },
        {
          "path": "mutation/recovery_intent.json",
          "sha256": "4ce214efd9f8fce40dea4f8326cb7154bdda207cc8a180ec01dcc4288bbb12e1",
          "size_bytes": 751
        },
        {
          "path": "mutation/restoration_record.json",
          "sha256": "6f0a51f8cda570b8b614666a0f902dae8faffdc74be6ccc3be01b650fa79a3f0",
          "size_bytes": 4319
        },
        {
          "path": "parsed/evidence_v4.json",
          "sha256": "a8717f527a3964967f3f73b032b1307420f37057b7fc8fbbec07a0ee9dfe6dd7",
          "size_bytes": 6399
        },
        {
          "path": "parsed/feature_vector_v2.json",
          "sha256": "369dd98efe11497a584b1e8576fd6692a0cd9f18228a9da3656210578d9882de",
          "size_bytes": 1308
        },
        {
          "path": "raw/v4/service_state_collector_v2/dhcp_endpoint_protocol_state.json",
          "sha256": "aa17258941e514ed774eb0fa1868c347d07b5f94982f33e7b4bb955e101e558b",
          "size_bytes": 977
        },
        {
          "path": "raw/v4/service_state_collector_v2/dhcp_fresh_lease_exchange.json",
          "sha256": "183d302eb351b66b8b11f5ef7d9711526659e70499cd30334cebf2505f8d5f41",
          "size_bytes": 1282
        },
        {
          "path": "raw/v4/service_state_collector_v2/dhcp_pool_configuration.json",
          "sha256": "daf82ea8533e8fcb74d4b88f232a163c0b20111b84405c89d74c76bf95cdc592",
          "size_bytes": 610
        },
        {
          "path": "raw/v4/service_state_collector_v2/dns_network_probe.json",
          "sha256": "9804833fa72eb458683bb6b34512dd0e0077b6cadd2237aa766a52ec845d5dbb",
          "size_bytes": 584
        },
        {
          "path": "raw/v4/service_state_collector_v2/dns_query.json",
          "sha256": "31e815ea18cd8dce467b3036d8a65e345cda9e541029edbb5890b492f9c5754c",
          "size_bytes": 345
        },
        {
          "path": "raw/v4/service_state_collector_v2/service_policy.json",
          "sha256": "95a9d3b2d8772564c197a59fa82878d0661cd72ae548685fca4e2a4bf3da3089",
          "size_bytes": 332
        },
        {
          "path": "raw/v4/service_state_collector_v2/service_port.json",
          "sha256": "b03407ffb7055c289a63ac1fbe49d47d26813f157b385b48a3224f010cf3a9bb",
          "size_bytes": 389
        },
        {
          "path": "raw/v4/service_state_collector_v2/service_process.json",
          "sha256": "de2ee080ee8b7757881b4d955d9aa9dffe49454dda8079ad5993d2a80ddce099",
          "size_bytes": 319
        },
        {
          "path": "validation/baseline_after.json",
          "sha256": "412b6618b197dffa6dcc084371ae21262b1361dbaab9705e0115d39e9b9e3900",
          "size_bytes": 1055
        },
        {
          "path": "validation/baseline_before.json",
          "sha256": "7a5275e8fda91e3cd46b5127819aa5ce2423c79264b4c5d52c0f250dfff0fd3c",
          "size_bytes": 1055
        }
      ],
      "fault_type": "dhcp_pool_misconfiguration",
      "relative_run_path": "data/raw/x4_revalidation.MHRrrP/x4_r2/x4-r2-real-dhcp-pool-misconfiguration",
      "release_id": "X4_R2_DHCP_POOL_MISCONFIGURATION",
      "rule_id": "R_X4_SERVICE_SECURITY_002",
      "run_tree_sha256": "923350ada7ec00b6751da49d8859dd2c589fa5d50c7155a3603ad312ecc6efaf",
      "topology_context_id": "x4_top_01_dhcp_dns_service_security_dhcp_flow_context_v1"
    },
    {
      "artifacts": [
        {
          "path": "diagnosis/diagnosis_result_v2.json",
          "sha256": "c1b57d82213265259f3e328d69e2e41a2d494fe2fd3933c9f745d5b4247eefd0",
          "size_bytes": 801
        },
        {
          "path": "manifest.json",
          "sha256": "a27494d121aadd754e5bac3271072bb61e4f5b54ea1efe879efa4e19d0a0c50c",
          "size_bytes": 548
        },
        {
          "path": "mutation/injection_record.json",
          "sha256": "d4833337083b20228ce1adbcd92dc9c4aa719899b97dab2249203d2383ae9dab",
          "size_bytes": 5938
        },
        {
          "path": "mutation/preconditions.json",
          "sha256": "b5f03bc5a53140c706534b284ba575ed99f38c678a334bf6f481277050a3770d",
          "size_bytes": 4471
        },
        {
          "path": "mutation/recovery_intent.json",
          "sha256": "154504303721cce1cecd731f378917afbecdc796bd6329130f5daff00adc57eb",
          "size_bytes": 993
        },
        {
          "path": "mutation/restoration_record.json",
          "sha256": "b934cbd4f8e6b9b57138d512d4d2dcf20cdde83871eb8694ae00e95011587a6c",
          "size_bytes": 5931
        },
        {
          "path": "parsed/evidence_v4.json",
          "sha256": "df2fe6fa1b9bac51b0d3ae7f0a10221b493921838a1f957058d432e52987529d",
          "size_bytes": 6428
        },
        {
          "path": "parsed/feature_vector_v2.json",
          "sha256": "20de33ee7da4e110e514b3284f3953af03b7ba4332960ae16cb5f468970e6fc9",
          "size_bytes": 1290
        },
        {
          "path": "raw/v4/service_state_collector_v3/application_port.json",
          "sha256": "a1d2b5f80a95c1125ef5c63e23155a361547d1d92fee56220d7cf949012d25c4",
          "size_bytes": 389
        },
        {
          "path": "raw/v4/service_state_collector_v3/application_process.json",
          "sha256": "92c3edd20cc3a928dab832d2a9c1e734145d113c8383b3379752ee184b3a21b0",
          "size_bytes": 319
        },
        {
          "path": "raw/v4/service_state_collector_v3/dhcp_fresh_lease_exchange.json",